{
  "track_id": "website_audit.lighthouse_handoff",
  "version": "1.0.0",
  "name": "Lighthouse Developer Handoff",
  "description": "First proof track — PageSpeed/Lighthouse report to developer handoff for coding agents.",
  "output_schema": "companion/schemas/lighthouse-handoff.schema.json",
  "steps": [
    {
      "id": "extract_metrics",
      "input_map": "$input",
      "executor": {
        "type": "tool",
        "tool": "lighthouse.parse",
        "task": "run"
      }
    },
    {
      "id": "classify_issues",
      "input_map": {
        "opportunities": ["$input.opportunities", []]
      },
      "executor": {
        "type": "tool",
        "tool": "lighthouse.classify_audits",
        "task": "run"
      }
    },
    {
      "id": "prioritize_fixes",
      "executor": {
        "type": "model",
        "role": "priority_helper",
        "schema": "companion/pit-crew/schemas/prioritize-fixes.schema.json",
        "prompt_template": "prioritize_fixes"
      }
    },
    {
      "id": "validate_priority_fixes",
      "input_map": {
        "opportunities": ["$input.opportunities", []],
        "priorityFixes": ["$artifacts.prioritize_fixes.priorityFixes", []],
        "thinking": ["$artifacts.prioritize_fixes.thinking", ""]
      },
      "executor": {
        "type": "tool",
        "tool": "lighthouse.validate_priority_fixes",
        "task": "run"
      }
    },
    {
      "id": "match_fixes",
      "input_map": {
        "issues": ["$artifacts.classify_issues.issues", []],
        "priorityFixes": ["$artifacts.validate_priority_fixes.priorityFixes", []]
      },
      "executor": {
        "type": "tool",
        "tool": "lighthouse.match_fixes",
        "task": "run"
      }
    },
    {
      "id": "write_handoff",
      "input_map": {
        "url": "$input.url",
        "metrics": ["$artifacts.extract_metrics", {}],
        "classifiedIssues": ["$artifacts.classify_issues", {}],
        "prioritizedFixes": ["$artifacts.validate_priority_fixes", "$artifacts.prioritize_fixes", {}],
        "matchedFixes": ["$artifacts.match_fixes", {}],
        "opportunities": ["$input.opportunities", []],
        "rankedOpportunities": [
          "$artifacts.classify_issues.rankedOpportunities",
          "$artifacts.extract_metrics.rankedOpportunities",
          []
        ]
      },
      "executor": {
        "type": "tool",
        "tool": "lighthouse-handoff",
        "task": "compose-handoff"
      }
    },
    {
      "id": "verify_output",
      "input_map": {
        "handoff": ["$artifacts.write_handoff", {}]
      },
      "executor": {
        "type": "tool",
        "tool": "lighthouse.verify_handoff",
        "task": "run"
      }
    }
  ]
}
